{
  "schemaVersion": 1,
  "id": "demo-t20260902-101112",
  "title": "demo",
  "status": "done",
  "owner": "owner",
  "created": "2026-09-02T10:11:12.345Z",
  "updated": "2026-09-02T10:11:12.345Z",
  "participants": [
    {
      "id": "owner",
      "role": "owner",
      "harness": "fake",
      "mode": "attached",
      "sessionRef": "sess-owner",
      "capabilities": {
        "spawn": true,
        "attach": true,
        "activation": "push",
        "inspect": true,
        "stop": true
      },
      "metadata": {}
    },
    {
      "id": "w-api",
      "role": "worker",
      "harness": "fake",
      "mode": "managed",
      "sessionRef": "sess-w-api",
      "capabilities": {
        "spawn": true,
        "attach": true,
        "activation": "push",
        "inspect": true,
        "stop": true
      },
      "metadata": {
        "repo": "ns/repo"
      }
    }
  ],
  "adapter": {}
}
